{
    "$schema": "../TcHmiFramework/Schema/FunctionDescription.Schema.json",
    "apiVersion": 1,
    "version": {
        "full": "14.3.229.0",
        "major": 14,
        "minor": 3,
        "build": 229,
        "revision": 0
    },
    "dependencyFiles": [
        {
            "name": "NumberToBigInt.js",
            "type": "JavaScript",
            "description": ""
        }
    ],
    "function": {
        "name": "NumberToBigInt",
        "namespace": "TcHmi.Functions.Beckhoff",
        "displayName": "NumberToBigInt",
        "visible": true,
        "description": "Converts a number value to bigint",
        "category": "Data Conversion",
        "returnValue": {
            "type": "tchmi:general#/definitions/BigInt"
        },
        "arguments": [
            {
                "name": "value",
                "displayName": "Value",
                "type": "tchmi:general#/definitions/Number",
                "description": "Value to be converted",
                "required": true,
                "bindable": true
            }
        ]
    }
}