{
    "$schema": "../TcHmiFramework/Schema/FunctionDescription.Schema.json",
    "apiVersion": 1,
    "version": {
        "full": "14.3.229.0",
        "major": 14,
        "minor": 3,
        "build": 229,
        "revision": 0
    },
    "dependencyFiles": [
        {
            "name": "RemoveBinding.js",
            "type": "JavaScript",
            "description": ""
        }
    ],
    "function": {
        "name": "RemoveBinding",
        "namespace": "TcHmi.Functions.Beckhoff",
        "displayName": "RemoveBinding",
        "description": "Removes a binding between a symbol and a control attribute setter function by name of property.",
        "category": "Binding",
        "returnValue": null,
        "arguments": [
            {
                "name": "control",
                "displayName": "Control",
                "type": "tchmi:framework#/definitions/Control",
                "description": "Control",
                "required": true,
                "bindable": false,
                "restParameter": false
            },
            {
                "name": "propertyName",
                "displayName": "PropertyName",
                "type": "tchmi:framework#/definitions/ControlPropertyName",
                "description": "The target attribute property name of control.",
                "required": true,
                "bindable": true,
                "restParameter": false,
                "refTo": "control"
            }
        ]
    }
}