{
    "$schema": "../TcHmiFramework/Schema/FunctionDescription.Schema.json",
    "apiVersion": 1,
    "version": {
        "full": "14.3.229.0",
        "major": 14,
        "minor": 3,
        "build": 229,
        "revision": 0
    },
    "dependencyFiles": [
        {
            "name": "Increment.js",
            "type": "JavaScript",
            "description": ""
        }
    ],
    "function": {
        "name": "Increment",
        "namespace": "TcHmi.Functions.Beckhoff",
        "displayName": "Increment",
        "visible": true,
        "description": "Increment a binding value.",
        "category": "Data Conversion",
        "injectContextObject": true,
        "waitMode": "Asynchronous",
        "returnValue": null,
        "arguments": [
            {
                "name": "ctx",
                "displayName": "ctx",
                "type": "tchmi:framework#/definitions/ContextReference",
                "description": "Context Reference",
                "required": true,
                "bindable": false
            },
            {
                "name": "value",
                "displayName": "Value",
                "type": "tchmi:framework#/definitions/TcHmi.Functions.Beckhoff.Increment.IncrementValueSymbol",
                "description": "Value to be incremented",
                "required": true,
                "bindable": true
            },
            {
                "name": "maxValue",
                "displayName": "MaxValue",
                "type": "tchmi:general#/definitions/Number",
                "description": "Maximum value (inclusive) to which the symbol will incremented",
                "required": false,
                "bindable": true
            },
            {
                "name": "stepWidth",
                "displayName": "StepWidth",
                "type": "tchmi:general#/definitions/Number",
                "description": "Used step width for increment",
                "required": false,
                "bindable": true
            }
        ]
    },
    "dataTypes": [
        {
            "schema": "Schema/Types.Schema.json"
        }
    ]
}