{
    "$schema": "../TcHmiFramework/Schema/FunctionDescription.Schema.json",
    "apiVersion": 1,
    "version": {
        "full": "14.3.229.0",
        "major": 14,
        "minor": 3,
        "build": 229,
        "revision": 0
    },
    "dependencyFiles": [
        {
            "name": "SetElementByIndex.js",
            "type": "JavaScript",
            "description": ""
        }
    ],
    "function": {
        "name": "SetElementByIndex",
        "namespace": "TcHmi.Functions.Beckhoff",
        "displayName": "SetElementByIndex",
        "visible": true,
        "description": "Inserts the value at the array index position.",
        "category": "Data Conversion",
        "waitMode": "Asynchronous",
        "injectContextObject": true,
        "returnValue": null,
        "arguments": [
            {
                "name": "ctx",
                "displayName": "ctx",
                "type": "tchmi:framework#/definitions/ContextReference",
                "description": "Context Reference",
                "required": true,
                "bindable": false
            },
            {
                "name": "arraySymbol",
                "displayName": "ArraySymbol",
                "type": "tchmi:framework#/definitions/Symbol",
                "description": "Value to be trimmed",
                "required": true,
                "bindable": true
            },
            {
                "name": "index",
                "displayName": "Index",
                "type": "tchmi:framework#/definitions/PositiveNumber",
                "description": "Index",
                "required": true,
                "bindable": true
            },
            {
                "name": "value",
                "displayName": "Value",
                "type": "tchmi:general#/definitions/Any",
                "description": "Value to write to the array.",
                "required": true,
                "bindable": true
            }
        ]
    }
}