{
    "$schema": "../TcHmiFramework/Schema/FunctionDescription.Schema.json",
    "apiVersion": 1,
    "version": {
        "full": "14.3.229.0",
        "major": 14,
        "minor": 3,
        "build": 229,
        "revision": 0
    },
    "dependencyFiles": [
        {
            "name": "ConvertBooleanToEnum.js",
            "type": "JavaScript",
            "description": ""
        }
    ],
    "function": {
        "name": "ConvertBooleanToEnum",
        "namespace": "TcHmi.Functions.Beckhoff",
        "displayName": "ConvertBooleanToEnum",
        "visible": true,
        "description": "Converts boolean values to enumeration values.",
        "category": "Data Conversion",
        "returnValue": {
            "type": "tchmi:general#/definitions/String"
        },
        "arguments": [
            {
                "name": "value",
                "displayName": "Value",
                "type": "tchmi:general#/definitions/Boolean",
                "description": "Value to be converted",
                "required": true,
                "bindable": true
            },
            {
                "name": "trueValue",
                "displayName": "TrueValue",
                "type": "tchmi:general#/definitions/String",
                "description": "Return value if source value is true",
                "required": true,
                "bindable": true
            },
            {
                "name": "falseValue",
                "displayName": "FalseValue",
                "type": "tchmi:general#/definitions/String",
                "description": "Return value if source value is false",
                "required": true,
                "bindable": true
            }
        ]
    }
}